kanji,id_5th_ed,id_6th_ed,keyword_5th_ed,keyword_6th_ed,components,on_reading,kun_reading,lesson,stroke,frequency,jlpt
捕,1836,1978,catch,catch,finger; fingers; dog-tag; arrowhead; screwdriver; utilize; utilise,ホ,と.らえる; と.らわれる; と.る; とら.える; とら.われる; つか.まえる; つか.まる,49,10,604,N3
哺,3027,1979,suckle,suckle,,ホ,はぐく.む; ふく.む,49,10,2461,
浦,1837,1980,bay,bay,water; water droplets; water pistol; dog-tag; arrowhead; screwdriver; utilize; utilise,ホ,うら,49,10,977,N1
蒲,1838,1981,bullrush,bullrush,bulrush; flowers; bay; water; water droplets; water pistol; dog-tag; arrowhead; screwdriver; utilize; utilise,ホ; ボ; フ; ブ,がま; かば; かま,49,13,1887,
舗,1839,1982,shop,shop,cottage; little-thatch; umbrella; earthenware jar; lidded crock; soil; dirt; ground; mouth; dog-tag; arrowhead; screwdriver; utilize; utilise,ホ,,49,15,1412,N1
補,1840,1983,supplement,supplement,cloak; dog-tag; arrowhead; screwdriver; utilize; utilise,ホ,おぎな.う,49,12,332,N2
邸,1841,1984,residence,residence,calling card; family name; one; floor; city walls,テイ,やしき,49,8,905,N1
郭,1842,1985,enclosure,enclosure,receive; tall; top hat; mouth; child; children; city walls,カク,くるわ,49,11,1670,N1
郡,1843,1986,county,county,old boy; mop; mouth; city walls,グン,こうり,49,10,965,N1
郊,1844,1987,outskirts,outskirts,mingle; top hat; father; city walls,コウ,,49,9,1304,N2
部,1845,1988,section,section,muzzle; vase; stand up; mouth; city walls,ブ,-べ,49,11,36,N3
都,1846,1989,metropolis,metropolis,someone; puppet; sooty; old man; sun; day; city walls,ト; ツ,みやこ,49,11,123,N3
郵,1847,1990,mail,mail,droop; silage; city walls,ユウ,,49,11,917,N2
邦,1848,1991,home country,home country,bushes; city walls,ホウ,くに,49,7,654,N1
那,2960,1992,interrogative,interrogative,sword; dagger; two; city walls,ナ; ダ,なに; なんぞ; いかん,49,7,1621,N1
郷,1849,1993,hometown,hometown,home town; cocoon; silver; city walls,キョウ; ゴウ,さと,49,11,1077,N1
響,1850,1994,echo,echo,home town; cocoon; silver; city walls; sound; vase; stand up; sun; day; tongue wagging,キョウ,ひび.く,49,20,502,N1
郎,1851,1995,son,son,halo; good; drop; silver; city walls,ロウ; リョウ,おとこ,49,9,569,N1
廊,1852,1996,corridor,corridor,cave; son; halo; good; drop; silver; city walls,ロウ,,49,12,1598,N1
盾,1853,1997,shield,shield,drag; ten; needle; eye,ジュン,たて,50,9,1476,N1
循,1854,1998,sequential,sequential,Nelson; column; going; line; shield; drag; ten; needle; eye,ジュン,,50,12,1699,N1
派,1855,1999,faction,faction,water; water droplets; water pistol; caveman; drag; person; rag,ハ,,50,9,164,N1
脈,1856,2000,vein,vein,moon; month; flesh; part of the body; caveman; drag; person; rag,ミャク,すじ,50,10,1477,N1
衆,1857,2001,masses,masses,blood; drop; dish; Carol in rags person; rag,シュウ; シュ,おお.い,50,12,450,N1
逓,1858,2002,parcel post,parcel post,drag; cornstalk; belt; road,テイ,かわ.る; たがいに,50,10,1957,N1
段,1859,2003,grade,grade,staple gun; cruise missile; missile; wind; crotch,ダン; タン,,50,9,479,N3
鍛,1860,2004,forge,forge,metal; gold; grade; staple gun; cruise missile; missile; wind; crotch,タン,きた.える,50,17,1793,N1
后,1861,2005,empress,empress,drag; one; ceiling; mouth,コウ; ゴ,きさき,50,6,1583,N1
幻,1862,2006,phantasm,phantasm,cocoon; clothes hanger; coat hanger,ゲン,まぼろし,50,4,1564,N1
司,1863,2007,director,director,clothes hanger; coat hanger; one; mouth,シ,つかさど.る,50,5,759,N1
伺,1864,2008,pay respects,pay respects,person; director; Ken Russel; clothes hanger; coat hanger; one; mouth,シ,うかが.う,50,7,2209,N2
詞,1865,2009,parts of speech,parts of speech,part of speech; say; words; keitai; mouth; director; Ken Russel; clothes hanger; coat hanger; one; mouth,シ,,50,12,1636,N2
飼,1866,2010,domesticate,domesticate,eat; food; umbrella; good; halo; drop; silver; director; Ken Russel; clothes hanger; coat hanger; one; mouth,シ,か.う,50,13,1392,N1
嗣,1867,2011,heir,heir,mouth; scrapbook; glass canopy; hood; flowers; director; Ken Russel; clothes hanger; coat hanger; one; mouth,シ,,50,13,2310,N1
舟,1868,2012,boat,boat,,シュウ,ふね; ふな-; -ぶね,50,6,1786,N2
舶,1869,2013,liner,liner,boat; white; dove,ハク,,50,11,1753,N1
航,1870,2014,navigate,navigate,boat; whirlwind; top hat; wind,コウ,,50,10,665,N2
舷,2675,2015,gunwale,gunwale,boat; mysterious; top hat; cocoon,ゲン,ふなべい; ふなばた,50,11,,
般,1871,2016,carrier,carrier,boat; cruise missile; missile; wind; crotch,ハン,,50,10,649,N2
盤,1872,2017,tray,tray,carrier; boat; cruise missile; missile; wind; crotch; dish,バン,,50,15,881,N1
搬,1873,2018,conveyor,conveyor,finger; fingers; carrier; boat; cruise missile; missile; wind; crotch,ハン,,50,13,1664,N1
船,1874,2019,ship,ship,boat; gully; eight; mouth,セン,ふね; ふな-,50,11,713,N3
艦,1875,2020,warship,warship,boat; oversee; retainer; slave; reclining; lying down; one; floor; dish,カン,,50,21,1363,N1
艇,1876,2021,rowboat,rowboat,boat; courts; porter; drop; samurai; stretch,テイ,,50,13,1433,N1
瓜,1877,2022,melon,melon,claw; vulture; elbow,カ; ケ,うり,50,6,2459,
弧,1878,2023,arc,arc,bow; melon; claw; vulture; elbow,コ,,50,9,2371,N1
孤,1879,2024,orphan,orphan,child; melon; claw; vulture; elbow,コ,,50,9,1239,N1
繭,1880,2025,cocoon,cocoon,flowers; hood; stick; thread; spiderman; insect,ケン,まゆ; きぬ,51,18,2495,N1
益,1881,2026,benefit,benefit,animal horns; one; floor; animal legs; eight; dish,エキ; ヤク,ま.す,51,10,674,N1
暇,1882,2027,spare time,spare time,sun; day; hobby; staples; mouth; box; crotch,カ,ひま; いとま,51,13,1386,N1
敷,1883,2028,spread,spread,arrowhead; rice field; brains; compass; direction; taskmaster,フ,し.く; -し.き,51,15,1212,N1
来,1884,2029,come,come,not yet; animal horns,ライ; タイ,く.る; きた.る; きた.す; き.たす; き.たる; き; こ,51,7,102,N5
気,1885,2030,spirit,spirit,landed fish; reclining; lying down; one; floor; fishhook; sheaf,キ; ケ,いき,51,6,113,N5
汽,1886,2031,vapor,vapor,water; water droplets; water pistol; landed fish; reclining; lying down; one; floor; fishhook,キ,,51,7,2020,N1
飛,1887,2032,fly,fly,hook; propeller; measuring box; thousand; needles,ヒ,と.ぶ; と.ばす; -と.ばす,51,9,580,N3
沈,1888,2033,sink,sink,water; water droplets; water pistol; garter; crown; human legs,チン; ジン,しず.む; しず.める,51,7,1271,N2
枕,2472,2034,pillow,pillow,tree; wood; garter; crown; human legs,チン; シン,まくら,51,8,2084,
妻,1889,2035,wife,wife,ten; needle; rake; woman,サイ,つま,51,8,691,N3
凄,2133,2036,nifty,nifty,ice; wife; ten; needle; rake; woman,セイ; サイ,さむ.い; すご.い; すさ.まじい,51,10,2313,
衰,1890,2037,decline,decline,pathetic; stick; top hat; scarf; mouth,スイ,おとろ.える,51,10,1432,N1
衷,1891,2038,inmost,inmost,ten; needle; mouth; scarf,チュウ,,51,9,2229,N1
面,1892,2039,mask,mask,hundred; one; ceiling; drop; pent in; eye,メン; ベン,おも; おもて; つら,51,9,186,N3
麺,2752,2040,noodles,noodles,barley; grow up; walking legs; mask; hundred; one; ceiling; drop; pent in; eye,メン; ベン,むぎこ,51,16,2331,
革,1893,2041,leather,leather,flowers; car; mouth; ten; needle,カク,かわ,51,9,249,N2
靴,1894,2042,shoes,shoes,leather; flowers; car; mouth; ten; needle; change; person; spoon; sitting on the ground,カ,くつ,51,13,1561,N3
覇,1895,2043,hegemony,hegemony,old west; leather; flowers; car; mouth; ten; needle; moon; month; flesh; part of the body,ハ; ハク,はたがしら,51,19,1173,N1
声,1896,2044,voice,voice,samurai; flag; stick,セイ; ショウ,こえ; こわ-,51,7,388,N3
眉,2583,2045,eyebrow,eyebrow,flag; stick; eye,ビ; ミ,まゆ,51,9,2177,N1
呉,1897,2046,give,give,mouth; chair; tool; animal legs,ゴ,く.れる; くれ,51,7,1729,N1
娯,1898,2047,recreation,recreation,woman; give; mouth; chair; tool; animal legs,ゴ,,51,10,1827,N1
誤,1899,2048,mistake,mistake,say; words; keitai; mouth; give; mouth; chair; tool; animal legs,ゴ,あやま.る; -あやま.る,51,14,1150,N3
蒸,1900,2049,steam,steam,flowers; helping hand; complete; water; one; floor; oven-fire; barbecue,ジョウ; セイ,む.す; む.れる; む.らす,51,13,1552,N2
承,1901,2050,acquiesce,acquiesce,water; complete; three,ショウ; ジョウ,うけたまわ.る; う.ける; ささ.げる; とど.める; たす.ける; こ.らす; つい.で; すく.う,51,8,775,N2
函,1902,2051,bin,bin,snare; sparkler; shovel,カン,はこ; い.れる,51,8,1781,
極,1903,2052,poles,poles,decay; tree; wood; snare; mouth; crotch; one; floor,キョク; ゴク,きわ.める; きわ.まる; きわ.まり; きわ.み; き.める; -ぎ.め; き.まる,51,12,460,N2
牙,1904,2053,tusk,tusk,,ガ; ゲ,きば; は; きばへん,52,5,2067,
芽,1905,2054,bud,bud,flowers; tusk,ガ,め,52,8,1691,N1
邪,1906,2055,wicked,wicked,tusk; city walls,ジャ,よこし.ま,52,8,1612,N1
雅,1907,2056,gracious,gracious,tusk; turkey,ガ,みや.び,52,13,1192,N1
釈,1908,2057,explanation,interpretation,animal tracks; drop; rice; shaku-hachi; flag; stick,シャク; セキ,とく; す.てる; ゆる.す,52,11,1097,N1
番,1909,2058,turn,turn,dice; animal tracks; drop; rice; rice field; brains,バン,つが.い,52,12,348,N3
審,1910,2059,hearing,hearing,house; dice; animal tracks; drop; rice; rice field; brains,シン,つまび.らか; つぶさ.に,52,15,412,N1
翻,1911,2060,flip,flip,dice; animal tracks; drop; rice; rice field; brains; feathers; wings,ホン; ハン,ひるがえ.る; ひるがえ.す,52,18,1465,N1
藩,1912,2061,clan,clan,flowers; water; water droplets; water pistol; dice; animal tracks; drop; rice; rice field; brains,ハン,,52,18,1896,N1
毛,1913,2062,fur,fur,,モウ,け,52,4,1179,N2
耗,1914,2063,decrease,decrease,christmas tree; fur,モウ; コウ; カウ,,52,10,,N1
尾,1915,2064,tail,tail,flag; fur,ビ,お,52,7,875,N1
宅,1916,2065,home,home,house; lock of hair,タク,,52,6,357,N3
託,1917,2066,consign,consign,say; words; keitai; mouth; lock of hair,タク,かこつ.ける; かこ.つ; かこ.つける,52,10,1021,N1
為,1918,2067,do,do,so; strange building; tail feathers,イ,ため; な.る; な.す; す.る; たり; つく.る; なり,52,9,831,N1
偽,1919,2068,falsehood,falsehood,person; do; so; strange building; tail feathers,ギ; カ,いつわ.る; にせ; いつわ.り,52,11,1171,N1
畏,2569,2069,apprehensive,apprehensive,rice field; brains; hairpin; safety-pin,イ,おそ.れる; かしこ.まる; かしこ; かしこ.し,52,9,2389,
長,1920,2070,long,long,hair; hairpin; safety-pin,チョウ,なが.い; おさ,52,8,12,N5
張,1921,2071,lengthen,lengthen,bow; long,チョウ,は.る; -は.り; -ば.り,52,11,403,N1
帳,1922,2072,notebook,notebook,towel; long,チョウ,とばり,52,11,1459,N1
脹,1923,2073,dilate,dilate,moon; month; flesh; part of the body; long,チョウ,は.れる; ふく.らむ; ふく.れる,52,12,,N1
髪,1924,2074,hair of the head,hair of the head,hairstyle; hair; shape; friend,ハツ,かみ,52,14,1474,N3
展,1925,2075,unfold,unfold,flag; salad; hairpin; safety-pin,テン,,52,10,352,N1
喪,1926,2076,miss,miss,soil; dirt; ground; mouth; hairpin; safety-pin,ソウ,も,52,12,885,N1
巣,1927,2077,nest,nest,owl; fruit; rice field; brains; tree; wood,ソウ,す; す.くう,53,11,1588,N1
単,1928,2078,simple,simple,owl; rice field; brains; ten; needle,タン,ひとえ,53,9,586,N3
戦,1929,2079,war,war,simple; owl; rice field; brains; ten; needle; fiesta,セン,いくさ; たたか.う; おのの.く; そよぐ; わなな.く,53,13,78,N3
禅,1930,2080,Zen,Zen,zen; altar; simple; owl; rice field; brains; ten; needle,ゼン; セン,しずか; ゆず.る,53,13,1902,N1
弾,1931,2081,bullet,bullet,bow; simple; owl; rice field; brains; ten; needle,ダン; タン,ひ.く; -ひ.き; はず.む; たま; はじ.く; はじ.ける; ただ.す; はじ.きゆみ,53,12,853,N1
桜,1932,2082,cherry tree,cherry tree,tree; wood; owl; woman,オウ; ヨウ,さくら,53,10,1237,N1
獣,1933,2083,animal,animal,owl; rice field; brains; one; mouth; chihuahua; dog; large; drop,ジュウ,けもの; けだもの,53,16,1714,N1
脳,1934,2084,brain,brain,moon; month; flesh; part of the body; owl; villain; sheaf; shovel,ノウ; ドウ,のうずる,53,11,459,N2
悩,1935,2085,trouble,trouble,Freud; state of mind; owl; villain; sheaf; shovel,ノウ,なや.む; なや.ます; なや.ましい; なやみ,53,10,1084,N2
厳,1936,2086,stern,stern,owl; cliff; daring; spike; ear; taskmaster,ゲン; ゴン,おごそ.か; きび.しい; いか.めしい; いつくし,53,17,638,N1
鎖,1937,2087,chain,chain,metal; gold; small; shellfish; clam; oyster; eye; animal legs; eight,サ,くさり; とざ.す,53,18,1250,N1
挙,1938,2088,raise,raise,owl; tool; hand,キョ,あ.げる; あ.がる; こぞ.る,53,10,257,N1
誉,1939,2089,reputation,reputation,owl; tool; say; words; keitai; mouth,ヨ,ほま.れ; ほ.める,53,13,1064,N1
猟,1940,2090,game hunting,game hunting,pack of wild dogs; anemometer; owl; wind; cornstalk,リョウ; レフ,かり; か.る,53,11,1851,N1
鳥,1941,2091,bird,bird,white; dove; one; tail feathers,チョウ,とり,53,11,1043,N4
鳴,1942,2092,chirp,chirp,mouth; bird,メイ,な.く; な.る; な.らす,53,14,1279,N3
鶴,1943,2093,crane,crane,turkey house; bird,カク,つる,53,21,1369,N1
烏,1944,2094,crow,crow,drop; mouth; one; tail feathers,ウ; オ,からす; いずくんぞ; なんぞ,53,10,2042,
蔦,1945,2095,vine,vine,flowers; bird,チョウ,つた,53,14,2215,N1
鳩,1946,2096,pigeon,pigeon,nine; baseball; bird,キュウ; ク,はと; あつ.める,53,13,1637,N1
鶏,1947,2097,chicken,chicken,claw; vulture; husband; bird,ケイ,にわとり; とり,53,19,1901,N1
島,1948,2098,island,island,bird; mountain,トウ,しま,53,10,245,N2
暖,1949,2099,warmth,warmth,sun; day; migrating ducks; claw; vulture; one; friend,ダン; ノン,あたた.か; あたた.かい; あたた.まる; あたた.める,53,13,1371,N1
媛,1950,2100,beautiful woman,beautiful woman,woman; migrating ducks; claw; vulture; one; friend,エン,ひめ,53,12,1735,N1
援,1951,2101,abet,abet,finger; fingers; migrating ducks; claw; vulture; one; friend,エン,,53,12,312,N1
緩,1952,2102,slacken,slacken,thread; spiderman; migrating ducks; claw; vulture; one; friend,カン,ゆる.い; ゆる.やか; ゆる.む; ゆる.める,53,15,933,N1
属,1953,2103,belong,belong,flag; gnats; drop; insect; belt,ゾク; ショク,さかん; つく; やから,53,12,912,N1
嘱,1954,2104,entrust,entrust,mouth; belong; flag; gnats; drop; insect; belt,ショク,しょく.する; たの.む,53,15,1903,N1
偶,1955,2105,accidentally,accidentally,person; talking cricket; brains; insect; belt,グウ,たま,53,11,1602,N3
遇,1956,2106,interview,interview,talking cricket; brains; insect; belt; road,グウ,あ.う,53,12,1343,N1
愚,1957,2107,foolish,foolish,talking cricket; brains; insect; belt; heart,グ,おろ.か,53,13,1551,N1
隅,1958,2108,corner,corner,pinnacle; parthenon; acropolis; talking cricket; brains; insect; belt,グウ,すみ,53,12,1601,N2
逆,1959,2109,inverted,inverted,mountain goat; horns; mountain; road,ギャク; ゲキ,さか; さか.さ; さか.らう,53,9,683,N2
塑,1960,2110,model,model,first day of the month; mountain goat; horns; mountain; moon; month; flesh; part of the body; soil; dirt; ground,ソ,でく,53,13,,N1
遡,2847,2111,go upstream,go upstream,first day of the month; mountain goat; horns; mountain; moon; month; flesh; part of the body; road,ソ; サク,さかのぼ.る,53,13,,
岡,1961,2112,Mount,Mount,mount; glass canopy; hood; mountain goat; horns; mountain,コウ,おか,53,8,463,
鋼,1962,2113,steel,steel,metal; gold; mount,コウ,はがね,53,16,1246,N1
綱,1963,2114,hawser,hawser,thread; spiderman; mount,コウ,つな,53,14,1053,N1
剛,1964,2115,sturdy,sturdy,mount; sword; sabre; saber,ゴウ,,53,10,1576,N1
缶,1965,2116,tin can,tin can,noon; sign of the horse; shovel,カン,かま,53,6,1543,N2
陶,1966,2117,pottery,pottery,pinnacle; parthenon; acropolis; bound up; tin can; noon; sign of the horse; shovel,トウ,,53,11,1680,N1
揺,1967,2118,swing,swing,finger; fingers; condor; claw; vulture; king; mountain,ヨウ,ゆ.れる; ゆ.る; ゆ.らぐ; ゆ.るぐ; ゆ.する; ゆ.さぶる; ゆ.すぶる; うご.く,53,12,1079,N1
謡,1968,2119,Noh chanting,Noh chanting,noh chanting; say; words; keitai; mouth; condor; claw; vulture; king; mountain,ヨウ,うた.い; うた.う,53,16,1580,N1
鬱,3030,2120,gloom,gloom,,ウツ,うっ.する; しげ.る; ふさ.ぐ,53,29,,
就,1969,2121,concerning,concerning,capital; tall; top hat; mouth; small; little; understandably; chihuahua with one human leg,シュウ; ジュ,つ.く; つ.ける,53,12,624,N1
蹴,2742,2122,kick,kick,wooden leg; mouth; stop; footprint; concerning; capital; tall; top hat; mouth; small; little; understandably; chihuahua with one human leg,シュク; シュウ,け.る,53,19,2377,
懇,1970,2123,sociable,sociable,skunk; silver; heart,コン,ねんご.ろ,53,17,1135,N1
墾,1971,2124,groundbreaking,groundbreaking,skunk; silver; soil; dirt; ground,コン,,53,16,,N1
貌,2733,2125,countenance,countenance,skunk; badger; white; dove; human legs,ボウ; バク,かたち; かたどる,53,14,,
免,1972,2126,excuse,excuse,village stocks; rabbit; bound up; human legs,メン,まぬか.れる; まぬが.れる,53,8,1080,N1
逸,1973,2127,elude,elude,deviate; village stocks; rabbit; bound up; human legs; road,イツ,そ.れる; そ.らす; はぐ.れる,53,11,1524,N1
晩,1974,2128,nightfall,nightfall,sun; day; village stocks; rabbit; bound up; human legs,バン,,53,12,1424,N3
勉,1975,2129,exertion,exertion,village stocks; rabbit; bound up; human legs; power; muscle; arnold,ベン,つと.める,53,10,1066,N4
象,1976,2130,elephant,elephant,colour; color; bound up; sow; pig,ショウ; ゾウ,かたど.る,53,12,394,N2
像,1977,2131,statue,statue,person; elephant; colour; color; bound up; sow; pig,ゾウ,,53,14,856,N2
馬,1978,2132,horse,horse,team of horses,バ,うま; うま-; ま,54,10,639,N3
駒,1979,2133,pony,pony,team of horses; phrase; bound up; mouth,ク,こま,54,15,1452,N1
験,1980,2134,verification,verification,team of horses; awl; fit; meeting; umbrella; mouth; person,ケン; ゲン,あかし; しるし; ため.す; ためし,54,18,410,N4
騎,1981,2135,equestrian,equestrian,team of horses; strange; large; St. Bernard; street; nail; spike; mouth,キ,,54,18,1696,N1
駐,1982,2136,parking,parking,stop-over; team of horses; candlestick; lord; drop; king; jewel; ball,チュウ,,54,15,955,N2
駆,1983,2137,drive,drive,team of horses; ward; box; sheaf,ク,か.ける; か.る,54,14,1033,N1
駅,1984,2138,station,station,team of horses; shaku-hachi; flag; stick,エキ,,54,14,724,N4
騒,1985,2139,boisterous,boisterous,team of horses; crotch; insect,ソウ,さわ.ぐ; うれい; さわ.がしい,54,18,1069,N1
駄,1986,2140,burdensome,burdensome,team of horses; plump; large; St. Bernard; drop,ダ; タ,,54,14,1500,N1
驚,1987,2141,wonder,wonder,awe; flowers; phrase; bound up; mouth; taskmaster; team of horses,キョウ,おどろ.く; おどろ.かす,54,22,1141,N1
篤,1988,2142,fervent,fervent,bamboo; team of horses,トク,あつ.い,54,16,1942,N1
罵,2699,2143,insult,insult,eye; cross-eyed; net; team of horses,バ,ののし.る,54,15,2467,
騰,1989,2144,inflation,inflation,edam; moon; month; flesh; part of the body; quarter; team of horses,トウ,,54,20,1420,N1
虎,1990,2145,tiger,tiger,magic wand; augury; cliff; hook; diced; seven; human legs,コ,とら,54,8,1653,N1
虜,1991,2146,captive,captive,tiger; male; rice field; brains; power; muscle; arnold,リョ; ロ,とりこ; とりく,54,13,1678,N1
膚,1992,2147,skin,skin,tiger; stomach; rice field; brains; moon; month; flesh; part of the body,フ,はだ,54,15,1679,N2
虚,1993,2148,void,void,tiger; row,キョ; コ,むな.しい; うつ.ろ,54,11,1454,N1
戯,1994,2149,frolic,frolic,void; tiger; row; fiesta,ギ; ゲ,たわむ.れる; ざ.れる; じゃ.れる,54,15,1880,N1
虞,1995,2150,uneasiness,uneasiness,tiger; give; mouth; chair; tool,グ,おそれ; おもんぱか.る; はか.る; うれ.える; あざむ.く; あやま.る; のぞ.む; たの.しむ,54,13,,N1
慮,1996,2151,prudence,prudence,tiger; think; rice field; brains; heart,リョ,おもんぱく.る; おもんぱか.る,54,15,916,N1
劇,1997,2152,drama,drama,tiger; sow; pig; sword; sabre; saber,ゲキ,,54,15,662,N2
虐,1998,2153,tyrannize,tyrannize,tiger; one; box,ギャク,しいた.げる,54,9,1464,N1
鹿,1999,2154,deer,deer,cave; antlers; compare; spoon; sitting on the ground,ロク,しか; か,54,11,957,N1
麓,2839,2155,foot of a mountain,foot of a mountain,grove; tree; wood; deer; cave; antlers; compare; spoon; sitting on the ground,ロク,ふもと,54,19,2366,
薦,2000,2156,recommend,recommend,flowers; deer; cave; antlers; slingshot; catapult; tail feathers,セン,すす.める,54,16,1082,N1
慶,2001,2157,jubilation,jubilation,deer; cave; antlers; crown; heart; walking legs,ケイ,よろこ.び,54,15,1300,N1
麗,2002,2158,lovely,lovely,one; ceiling; mediocre; deer; cave; antlers; compare,レイ,うるわ.しい; うら.らか,54,19,1758,N1
熊,2003,2159,bear,bear,ability; elbow; moon; month; flesh; part of the body; spoon; sitting on the ground; oven-fire; barbecue,ユウ,くま,54,14,1105,N1
能,2004,2160,ability,ability,elbow; moon; month; flesh; part of the body; spoon; sitting on the ground,ノウ,よ.く,54,10,273,N3
態,2005,2161,attitude,attitude,ability; elbow; moon; month; flesh; part of the body; spoon; sitting on the ground; heart,タイ,わざ.と,54,14,353,N1
寅,2006,2162,sign of the tiger,sign of the tiger,house; caterpillar; one; ceiling; sprout; shoot; animal legs; eight,イン,とら,55,11,1975,N1
演,2007,2163,performance,performance,water; water droplets; water pistol; sign of the tiger; house; caterpillar; one; ceiling; sprout; shoot; animal legs; eight,エン,,55,14,267,N3
辰,2008,2164,sign of the dragon,sign of the dragon,cliff; two; hairpin; safety-pin,シン; ジン,たつ,55,7,1600,N1
辱,2009,2165,embarrass,embarrass,sign of the dragon; cliff; two; hairpin; safety-pin; glue,ジョク,はずかし.める,55,10,1769,N1
震,2010,2166,quake,quake,rain; weather; sign of the dragon; cliff; two; hairpin; safety-pin,シン,ふる.う; ふる.える,55,15,893,N2
振,2011,2167,shake,shake,finger; fingers; sign of the dragon; cliff; two; hairpin; safety-pin,シン,ふ.る; ぶ.る; ふ.り; -ぶ.り; ふ.るう,55,10,614,N1
娠,2012,2168,with child,with child,woman; sign of the dragon; cliff; two; hairpin; safety-pin,シン,,55,10,1623,N1
唇,2013,2169,lips,lips,sign of the dragon; cliff; two; hairpin; safety-pin; mouth,シン,くちびる,55,10,1992,N1
農,2014,2170,agriculture,agriculture,bend; sign of the dragon; cliff; two; hairpin; safety-pin,ノウ,,55,13,385,N2
濃,2015,2171,concentrated,concentrated,water; water droplets; water pistol; agriculture; bend; sign of the dragon; cliff; two; hairpin; safety-pin,ノウ,こ.い,55,16,1200,N2
送,2016,2172,send off,send off,escort; golden calf; horns; heavens; road,ソウ,おく.る,55,9,311,N4
関,2017,2173,connection,connection,gates; golden calf; horns; heavens,カン,せき; -ぜき; かか.わる; からくり; かんぬき,55,14,70,N3
咲,2018,2174,blossom,blossom,mouth; golden calf; horns; heavens,ショウ,さ.く; -ざき,55,9,1534,N2
鬼,2019,2175,ghost,ghost,oni; drop; brains; rice field; human legs; elbow,キ,おに; おに-,55,10,1557,N1
醜,2020,2176,ugly,ugly,whiskey bottle; ghost; oni; drop; brains; rice field; human legs; elbow,シュウ,みにく.い; しこ,55,17,2074,N1
魂,2021,2177,soul,soul,rising cloud; two; elbow; wall; ghost; oni; drop; brains; rice field; human legs; elbow,コン,たましい; たま,55,14,1748,N1
魔,2022,2178,witch,witch,hemp; cliff; grove; tree; wood; ghost; oni; drop; brains; rice field; human legs; elbow,マ,,55,21,1514,N1
魅,2023,2179,fascination,fascination,ghost; oni; drop; brains; rice field; human legs; elbow; not yet; one; tree; wood,ミ,,55,15,1206,N1
塊,2024,2180,clod,clod,soil; dirt; ground; ghost; oni; drop; brains; rice field; human legs; elbow,カイ; ケ,かたまり; つちくれ,55,13,1800,N1
襲,2025,2181,attack,attack,old dragon; vase; stand up; moon; month; flesh; part of the body; slingshot; catapult; snake; self; three; cloth; clothes; clothing; garment; dragon*,シュウ,おそ.う; かさ.ね,55,22,1130,N1
嚇,2026,2182,upbraid,upbraid,menacing; mouth; incandescent; red,カク,おど.かす,56,17,2141,N1
朕,2027,2183,majestic plural,majestic plural,moon; month; flesh; part of the body; golden calf; horns; heavens,チン,,56,10,,N1
雰,2028,2184,atmosphere,atmosphere,rain; weather; part,フン,,56,12,1341,N1
箇,2029,2185,item,item,bamboo; harden; pent in; old; tombstone; gravestone; church; ten; needle; mouth,カ; コ,,56,14,,N1
錬,2030,2186,tempering,tempering,metal; gold; east; tree; wood; sun; day,レン,ね.る,56,16,2221,N1
遵,2031,2187,abide by,abide by,revered; Mother Teresa; chieftain; Molotov cocktail; animal horns; whiskey bottle; glue; road,ジュン,,56,15,,N1
罷,2032,2188,quit,quit,eye; cross-eyed; net; ability; elbow; moon; month; flesh; part of the body; spoon; sitting on the ground,ヒ,まか.り-; や.める,56,15,2104,N1
屯,2033,2189,barracks,barracks,earthworm; drop; shovel; fishhook,トン,,56,4,1980,N1
且,2034,2190,moreover,moreover,shelf; my bookshelves,ショ; ソ; ショウ,か.つ,56,5,,N1
藻,2035,2191,seaweed,seaweed,flowers; water; water droplets; water pistol; furniture; goods; mouth; tree; wood,ソウ,も,56,19,2124,N1
隷,2036,2192,slave,slave,samurai; altar; show; two; small; sieve; rake; grains of rice,レイ,したが.う; しもべ,56,16,2009,N1
