kanji,id_5th_ed,id_6th_ed,keyword_5th_ed,keyword_6th_ed,components,on_reading,kun_reading,lesson,stroke,frequency,jlpt
峡,1265,1355,gorge,gorge,mountain; scissors; husband; horns,キョウ; コウ,はざま,34,9,1833,N1
狭,1266,1356,cramped,cramped,pack of wild dogs; scissors; husband; horns,キョウ; コウ,せま.い; せば.める; せば.まる; さ,34,9,1346,N1
挟,1267,1357,sandwiched,sandwiched,finger; fingers; scissors; husband; horns,キョウ; ショウ,はさ.む; はさ.まる; わきばさ.む; さしはさ.む,34,9,1870,N2
頬,2792,1358,cheek,cheek,,,,34,15,2424,
追,1268,1359,chase,chase,maestro; road,ツイ,お.う,34,9,411,N3
阜,2928,1360,large hill,large hill,maestro; ten; needle,フ; フウ,,34,8,1532,
師,1269,1361,expert,expert,maestro; noren; one; ceiling; towel,シ; ス,もろもろ; なら.う,34,10,563,N3
帥,1270,1362,commander,commander,maestro; towel,スイ,,34,9,2016,N1
官,1271,1363,bureaucrat,bureaucrat,house; maestro without baton,カン,,34,8,230,N3
棺,1272,1364,coffin,coffin,tree; wood; bureaucrat; house; maestro without baton,カン,,34,12,2161,N1
管,1273,1365,pipe,pipe,bamboo; bureaucrat; house; maestro without baton,カン,くだ,34,14,517,N2
父,1274,1366,father,father,,フ,ちち,34,4,646,N5
釜,2332,1367,cauldron,cauldron,father; metal; gold,フ,かま,34,10,1761,
交,1275,1368,mingle,mingle,top hat; father,コウ,まじ.わる; まじ.える; ま.じる; まじ.る; ま.ざる; ま.ぜる; -か.う; か.わす; かわ.す; こもごも,34,6,178,N3
効,1276,1369,merit,merit,mingle; top hat; father; power; muscle; arnold,コウ,き.く; ききめ; なら.う,34,8,538,N2
較,1277,1370,contrast,contrast,car; mingle; top hat; father,カク; コウ,くら.べる,34,13,1172,N1
校,1278,1371,exam,exam,tree; wood; mingle; top hat; father,コウ; キョウ,,34,10,294,N5
足,1279,1372,leg,leg,mouth; mending; mend,ソク,あし; た.りる; た.る; た.す,34,7,343,N4
促,1280,1373,stimulate,stimulate,person; leg; mouth; mending; mend,ソク,うなが.す,34,9,998,N1
捉,2260,1374,nab,nab,finger; fingers; leg; mouth; mend,ソク; サク,とら.える,34,10,1976,
距,1281,1375,long-distance,long-distance,wooden leg; mouth; stop; footprint; giant,キョ,へだ.たる; けづめ,34,12,1191,N1
路,1282,1376,path,path,wooden leg; mouth; stop; footprint; each; walking legs; mouth,ロ; ル,-じ; みち,34,13,529,N3
露,1283,1377,dew,dew,rain; weather; path; wooden leg; mouth; stop; footprint; each; walking legs; mouth,ロ; ロウ,つゆ,34,21,928,N1
跳,1284,1378,hop,hop,wooden leg; mouth; stop; footprint; portent; omen,チョウ,は.ねる; と.ぶ; -と.び,34,13,1716,N1
躍,1285,1379,leap,leap,wooden leg; mouth; stop; footprint; futon; feathers; wings; turkey,ヤク,おど.る,34,21,900,N1
践,1286,1380,tread,tread,wooden leg; mouth; stop; footprint; parade float,セン,ふ.む,34,13,1570,N1
踏,1287,1381,step,step,wooden leg; mouth; stop; footprint; wednesday; boots; water; sun; day,トウ,ふ.む; ふ.まえる,34,15,723,N1
踪,3019,1382,trail,trail,,ショウ; ソウ,あと,34,15,,
骨,1288,1383,skeleton,skeleton,joint; moon; month; flesh; part of the body,コツ,ほね,34,10,936,N2
滑,1289,1384,slippery,slippery,water; water droplets; water pistol; skeleton; joint; moon; month; flesh; part of the body,カツ; コツ,すべ.る; なめ.らか,34,13,1238,N1
髄,1290,1385,marrow,marrow,skeleton; joint; moon; month; flesh; part of the body; highwayman; possess; by one’s side; road,ズイ,,34,19,1652,N1
禍,1291,1386,calamity,calamity,altar; jawbone; joint; hood; mouth,カ,わざわい,34,13,2010,N1
渦,1292,1387,whirlpool,whirlpool,water; water droplets; water pistol; jawbone; joint; hood; mouth,カ,うず,34,12,1789,N1
鍋,2757,1388,pot,pot,metal; gold; jawbone; joint; hood; mouth,カ,なべ,34,17,1810,
過,1293,1389,overdo,overdo,jawbone; joint; hood; mouth; road,カ,す.ぎる; -す.ぎる; -す.ぎ; す.ごす; あやま.つ; あやま.ち; よ.ぎる,34,12,285,N3
阪,1294,1390,Heights,Heights,heights; pinnacle; parthenon; acropolis; anti-; demonstration; cliff; crotch,ハン,さか,35,7,503,
阿,1295,1391,Africa,Africa,africa; pinnacle; parthenon; acropolis; can; mouth; street; nail; spike,ア; オ,おもね.る,35,8,1126,N1
際,1296,1392,occasion,occasion,pinnacle; parthenon; acropolis; ritual; moon; month; flesh; part of the body; crotch; altar; show; two; small,サイ,きわ; -ぎわ,35,14,183,N3
障,1297,1393,hinder,hinder,pinnacle; parthenon; acropolis; badge; vase; stand up; sunflower; early; sun; day; ten; needle,ショウ,さわ.る,35,14,742,N1
隙,2426,1394,chink,chink,pinnacle; parthenon; acropolis; small; little; sun; day; little,ゲキ; キャク; ケキ,すき; す.く; す.かす; ひま,35,13,,
随,1298,1395,follow,follow,pinnacle; parthenon; acropolis; highwayman; possess; by one’s side; moon; month; flesh; part of the body; road,ズイ,まにまに; したが.う,35,12,1396,N1
陪,1299,1396,auxiliary,auxiliary,obeisance; pinnacle; parthenon; acropolis; muzzle; vase; stand up; mouth,バイ,,35,11,1917,N1
陽,1300,1397,sunshine,sunshine,pinnacle; parthenon; acropolis; piggy bank; sun; day; piglets,ヨウ,ひ,35,12,1071,N3
陳,1301,1398,line up,line up,exhibit; pinnacle; parthenon; acropolis; east; tree; wood; sun; day,チン,ひ.ねる,35,11,1323,N1
防,1302,1399,ward off,ward off,pinnacle; parthenon; acropolis; compass; direction,ボウ,ふせ.ぐ,35,7,331,N2
附,1303,1400,affixed,affixed,pinnacle; parthenon; acropolis; adhere; sellotape; person; glue,フ,つ.ける; つ.く,35,8,2396,N1
院,1304,1401,Inst.,Inst.,pinnacle; parthenon; acropolis; perfect; house; beginnings; two; human legs,イン,,35,10,150,N4
陣,1305,1402,camp,camp,pinnacle; parthenon; acropolis; car,ジン,,35,10,828,N1
隊,1306,1403,regiment,regiment,pinnacle; parthenon; acropolis; animal horns; sow; pig; wart hog; regimental mascot,タイ,,35,12,605,N1
墜,1307,1404,crash,crash,regiment; pinnacle; parthenon; acropolis; animal horns; sow; pig; wart hog; regimental mascot; soil; dirt; ground,ツイ,お.ちる; お.つ,35,15,1466,N1
降,1308,1405,descend,descend,pinnacle; parthenon; acropolis; walking legs; sunglasses with one lens missing; monocle,コウ; ゴ,お.りる; お.ろす; ふ.る; ふ.り; くだ.る; くだ.す,35,10,596,N3
階,1309,1406,story,story,storey; pinnacle; parthenon; acropolis; all; compare; spoon; sitting on the ground; white; dove,カイ,きざはし,35,12,513,N2
陛,1310,1407,highness,highness,pinnacle; parthenon; acropolis; compare; spoon; sitting on the ground; soil; dirt; ground,ヘイ,,35,10,1429,N1
隣,1311,1408,neighboring,neighboring,neighbouring; pinnacle; parthenon; acropolis; shoeshine; rice; sunglasses; dancing legs; ballerina; evening,リン,とな.る; となり,35,16,1083,N1
隔,1312,1409,isolate,isolate,pinnacle; parthenon; acropolis; tripod; one; ceiling; mouth; hood; human legs; street; nail; spike,カク,へだ.てる; へだ.たる,35,13,1382,N1
隠,1313,1410,conceal,conceal,pinnacle; parthenon; acropolis; hideaway; claw; vulture; broom; heart,イン; オン,かく.す; かく.し; かく.れる; かか.す; よ.る,35,14,1089,N1
堕,1314,1411,degenerate,degenerate,pinnacle; parthenon; acropolis; possess; by one’s side; moon; month; flesh; part of the body; ground; soil; dirt; ground,ダ,お.ちる; くず.す; くず.れる,35,12,2087,N1
陥,1315,1412,collapse,collapse,pinnacle; parthenon; acropolis; straight-jacket; bound up; olden times; old days; stick; sun; day,カン,おちい.る; おとしい.れる,35,10,1154,N1
穴,1316,1413,hole,hole,house; eight,ケツ,あな,35,5,1366,N1
空,1317,1414,empty,empty,hole; house; human legs; craft,クウ,そら; あ.く; あ.き; あ.ける; から; す.く; す.かす; むな.しい,35,8,304,N4
控,1318,1415,withdraw,withdraw,finger; fingers; empty; sky; hole; house; human legs; craft,コウ,ひか.える; ひか.え,35,11,1000,N1
突,1319,1416,stab,stab,hole; house; human legs; large; St. Bernard,トツ; カ,つ.く,35,8,521,N3
究,1320,1417,research,research,hole; house; human legs; nine; baseball,キュウ; ク,きわ.める,35,7,368,N4
窒,1321,1418,plug up,plug up,hole; house; human legs; climax; wall; one; ceiling; elbow; soil; dirt; ground,チツ,,35,11,1776,N1
窃,1322,1419,stealth,stealth,hole; house; human legs; cut; seven; sword; dagger,セツ,ぬす.む; ひそ.か,35,9,1871,N1
窟,2615,1420,cavern,cavern,hole; house; human legs; yield; flag; exit,クツ; コツ,いわや; いはや; あな,35,13,,
窪,1323,1421,depression,depression,hole; house; human legs; water; water droplets; water pistol; ivy; square jewel; soil; dirt; ground,ワ; ア,くぼ.む; くぼ.み; くぼ.まる; くぼ,35,14,1853,
搾,1324,1422,squeeze,squeeze,finger; fingers; tight; hole; house; human legs; saw,サク,しぼ.る,35,13,2046,N1
窯,1325,1423,kiln,kiln,hole; house; human legs; sheep; oven-fire; barbecue,ヨウ,かま,35,15,2072,N1
窮,1326,1424,hard up,hard up,hole; house; human legs; somebody; nose; bow,キュウ; キョウ,きわ.める; きわ.まる; きわ.まり; きわ.み,35,15,1756,N1
探,1327,1425,grope,grope,finger; fingers; paper punch; Miss World; hole; house; human legs; tree; wood,タン,さぐ.る; さが.す,35,11,930,N3
深,1328,1426,deep,deep,water; water droplets; water pistol; paper punch; Miss World; hole; house; human legs; tree; wood,シン,ふか.い; -ぶか.い; ふか.まる; ふか.める; み-,35,11,484,N3
丘,1329,1427,hill,hill,axe; one; floor,キュウ,おか,35,5,1405,N1
岳,1330,1428,Point,Point,point; hill; axe; one; floor; mountain,ガク,たけ,35,8,1334,N1
兵,1331,1429,soldier,soldier,hill; axe; one; floor; animal legs; eight,ヘイ; ヒョウ,つわもの,35,7,522,N2
浜,1332,1430,seacoast,seacoast,water; water droplets; water pistol; soldier; hill; axe; one; floor; animal legs; eight,ヒン,はま,35,10,645,N1
糸,1333,1431,thread,thread,spiderman,シ,いと,36,6,1488,N2
織,1334,1432,weave,weave,thread; spiderman; kazoo; sound; vase; stand up; sun; day; fiesta,ショク; シキ,お.る; お.り; おり; -おり; -お.り,36,18,608,N1
繕,1335,1433,darning,darning,thread; spiderman; virtuous; sheep; horns; mouth,ゼン,つくろ.う,36,18,2195,N1
縮,1336,1434,shrink,shrink,thread; spiderman; inn; house; person; hundred; one; ceiling; white; dove,シュク,ちぢ.む; ちぢ.まる; ちぢ.める; ちぢ.れる; ちぢ.らす,36,17,909,N1
繁,1337,1435,luxuriant,luxuriant,cleverness; reclining; lying down; mother; breasts; taskmaster; thread; spiderman,ハン,しげ.る; しげ.く,36,16,1198,N1
縦,1338,1436,vertical,vertical,thread; spiderman; accompany; Nelson; column; going; line; horns; mend,ジュウ,たて,36,16,1258,N1
緻,3020,1437,fine,fine,,チ,こまか.い,36,16,2460,
線,1339,1438,line,line,thread; spiderman; spring; white; dove; water,セン,すじ,36,15,382,N2
綻,2670,1439,come apart at the seams,come apart at the seams,thread; spiderman; determine; determined; house; mend,タン,ほころ.びる,36,14,,
締,1340,1440,tighten,tighten,thread; spiderman; sovereign; vase; stand up; apron; crown; towel,テイ,し.まる; し.まり; し.める; -し.め; -じ.め,36,15,797,N1
維,1341,1441,fiber,fiber,thread; spiderman; turkey,イ,,36,14,643,N1
羅,1342,1442,gauze,gauze,eye; cross-eyed; net; fibre; thread; spiderman; turkey,ラ,うすもの,36,19,1831,N1
練,1343,1443,practice,practice,thread; spiderman; east; tree; wood; sun; day,レン,ね.る; ね.り,36,14,788,N2
緒,1344,1444,thong,thong,thread; spiderman; someone; puppet; sooty; old man; sun; day,ショ; チョ,お; いとぐち,36,14,952,N3
続,1345,1445,continue,continue,thread; spiderman; sell; samurai; crown; human legs,ゾク; ショク; コウ; キョウ,つづ.く; つづ.ける; つぐ.ない,36,13,141,N3
絵,1346,1446,picture,picture,thread; spiderman; meeting; one; wall; umbrella; rising cloud; two; elbow; wall,カイ; エ,,36,12,895,N3
統,1347,1447,overall,overall,thread; spiderman; allot; infant; toddler; top hat; elbow; human legs,トウ,す.べる; ほび.る,36,12,125,N1
絞,1348,1448,strangle,strangle,thread; spiderman; mingle; top hat; father,コウ,しぼ.る; し.める; し.まる,36,12,1288,N1
給,1349,1449,salary,salary,thread; spiderman; fit; meeting; umbrella; one; mouth,キュウ,たま.う; たも.う; -たま.え,36,12,615,N3
絡,1350,1450,entwine,entwine,thread; spiderman; each; walking legs; mouth,ラク,から.む; から.まる,36,12,806,N2
結,1351,1451,tie,tie,thread; spiderman; aerosol; samurai; mouth,ケツ; ケチ,むす.ぶ; ゆ.う; ゆ.わえる,36,12,162,N1
終,1352,1452,end,end,thread; spiderman; winter; walking legs; ice; drop,シュウ,お.わる; -お.わる; おわ.る; お.える; つい; つい.に,36,11,256,N4
級,1353,1453,class,class,thread; spiderman; reach out; outstretched hands,キュウ,,36,9,785,N1
紀,1354,1454,chronicle,chronicle,thread; spiderman; snake; self,キ,,36,9,780,N1
紅,1355,1455,crimson,crimson,thread; spiderman; craft,コウ; ク,べに; くれない; あか.い,36,9,1299,N2
納,1356,1456,settlement,settlement,thread; spiderman; inside; person; belt,ノウ; ナッ; ナ; ナン; トウ,おさ.める; -おさ.める; おさ.まる,36,10,987,N1
紡,1357,1457,spinning,spinning,thread; spiderman; compass; direction,ボウ,つむ.ぐ,36,10,1876,N1
紛,1358,1458,distract,distract,thread; spiderman; part; eight; sword; dagger,フン,まぎ.れる; -まぎ.れ; まぎ.らす; まぎ.らわす; まぎ.らわしい,36,10,994,N1
紹,1359,1459,introduce,introduce,thread; spiderman; summon; seduce; sword; dagger; mouth,ショウ,,36,11,963,N2
経,1360,1460,sutra,sutra,thread; spiderman; spool; clod; toilet paper; crotch; soil; dirt; ground,ケイ; キョウ,へ.る; た.つ; たていと; はか.る; のり,36,11,79,N3
紳,1361,1461,sire,sire,thread; spiderman; monkey; sun; day; stick,シン,,36,11,1790,N1
約,1362,1462,promise,promise,thread; spiderman; ladle,ヤク,,36,9,94,N3
細,1363,1463,dainty,dainty,thread; spiderman; rice field; brains,サイ,ほそ.い; ほそ.る; こま.か; こま.かい,36,11,537,N2
累,1364,1464,accumulate,accumulate,rice field; brains; thread; spiderman,ルイ,,36,11,1662,N1
索,1365,1465,cord,cord,bishop; cross; ten; needle; crown; thread; spiderman,サク,,36,10,1127,N1
総,1366,1466,general,general,thread; spiderman; public; eight; elbows; heart,ソウ,す.べて; すべ.て; ふさ,36,14,129,N2
綿,1367,1467,cotton,cotton,thread; spiderman; napkin; white; dove; towel,メン,わた,36,14,1495,N2
絹,1368,1468,silk,silk,thread; spiderman; mouth; moon; month; flesh; part of the body,ケン,きぬ,36,13,1916,N1
繰,1369,1469,winding,winding,thread; spiderman; furniture; goods; mouth; tree; wood,ソウ,く.る,36,19,872,N1
継,1370,1470,inherit,inherit,thread; spiderman; rice; fishhook,ケイ,つ.ぐ; まま-,36,13,743,N1
緑,1371,1471,green,green,thread; spiderman; dustpan; broom; grains of rice,リョク; ロク,みどり,36,14,1180,N2
縁,1372,1472,affinity,affinity,thread; spiderman; broom; sow; pig,エン; ネン,ふち; ふちど.る; ゆかり; よすが; へり; えにし,36,15,1291,N1
網,1373,1473,netting,netting,thread; spiderman; glass jar; hood; horns; one; deceased; perish; top hat; fishhook,モウ,あみ,36,14,1194,N1
緊,1374,1474,tense,tense,loincloth; retainer; slave; crotch; thread; spiderman,キン,,36,15,677,N1
紫,1375,1475,purple,purple,Prince; this here; stop; footprint; spoon; sitting on the ground; thread; spiderman,シ,むらさき,36,12,1516,N1
縛,1376,1476,truss,truss,thread; spiderman; acupuncturist; specialty; drop; ten; needle; rice field; brains; glue,バク,しば.る,36,16,1764,N1
縄,1377,1477,straw rope,straw rope,thread; spiderman; eels; sun; day,ジョウ,なわ; ただ.す,36,15,1075,N1
幼,1378,1478,infancy,infancy,cocoon; power; muscle; arnold,ヨウ,おさな.い,36,5,1227,N2
後,1379,1479,behind,behind,Nelson; column; going; line; cocoon; walking legs,ゴ; コウ,のち; うし.ろ; うしろ; あと; おく.れる,36,9,26,N5
幽,1380,1480,faint,faint,seclude; cocoon; mountain,ユウ; ヨウ,ふか.い; かす.か; くら.い; しろ.い,36,9,1996,N1
幾,1381,1481,how many,how many,cocoon; person; fiesta,キ,いく-; いく.つ; いく.ら,36,12,1725,N3
機,1382,1482,mechanism,mechanism,tree; wood; abacus; how many; cocoon; person; fiesta,キ,はた,36,16,127,N3
畿,2887,1483,capital suburbs,capital suburbs,cocoon; rice field; brains; fiesta,キ,みやこ,36,15,1683,
玄,1383,1484,mysterious,mysterious,top hat; cocoon,ゲン,,36,5,1409,N1
畜,1384,1485,livestock,livestock,mysterious; top hat; cocoon; rice field; brains,チク,,36,10,1824,N2
蓄,1385,1486,amass,amass,flowers; livestock; mysterious; top hat; cocoon; rice field; brains,チク,たくわ.える,36,13,1260,N1
弦,1386,1487,bowstring,bowstring,bow; mysterious; top hat; cocoon,ゲン,つる,36,8,1773,N1
擁,1387,1488,hug,hug,finger; fingers; mysterious; top hat; cocoon; turkey,ヨウ,,36,16,1213,N1
滋,1388,1489,nourishing,nourishing,water; water droplets; water pistol; double-mysterious; mothballs; horns; one; cocoon,ジ,,36,12,1563,N1
慈,1389,1490,mercy,mercy,double-mysterious; mothballs; horns; one; cocoon; heart,ジ,いつく.しむ,36,13,1811,N1
磁,1390,1491,magnet,magnet,stone; rock; double-mysterious; mothballs; horns; one; cocoon,ジ,,36,14,1686,N1
系,1391,1492,lineage,lineage,stick; drop; thread; spiderman,ケイ,,36,7,567,N1
係,1392,1493,person in charge,person in charge,person; lineage; drop; thread; spiderman,ケイ,かか.る; かかり; -がかり; かか.わる,36,9,232,N3
孫,1393,1494,grandchild,grandchild,child; lineage; drop; thread; spiderman,ソン,まご,36,10,1388,N2
懸,1394,1495,suspend,suspend,prefecture; eye; fishhook; small; little; lineage; stick; drop; thread; spiderman; heart,ケン; ケ,か.ける; か.かる,36,20,889,N1
遜,2422,1496,modest,modest,grandchild; child; lineage; drop; thread; spiderman; road,ソン,したが.う; へりくだ.る; ゆず.る,36,13,,
却,1395,1497,instead,instead,gone; soil; dirt; ground; elbow; stamp,キャク,かえ.って; しりぞ.く; しりぞ.ける,37,7,959,N1
脚,1396,1498,shins,shins,skids; moon; month; flesh; part of the body; instead; gone; soil; dirt; ground; elbow; stamp,キャク; キャ; カク,あし,37,11,1228,N1
卸,1397,1499,wholesale,wholesale,horseshoe; horse; pantomime horse; noon; sign of the horse; stop; footprint; stamp,シャ,おろ.す; おろし; おろ.し,37,9,1520,N1
御,1398,1500,honorable,honorable,Nelson; column; going; line; wholesale; horseshoe; pantomime horse; noon; sign of the horse; stop; footprint; stamp,ギョ; ゴ,おん-; お-; み-,37,12,1087,N3
服,1399,1501,clothing,clothing,moon; month; flesh; part of the body; underpants; stamp; crotch,フク,,37,8,873,N4
命,1400,1502,fate,fate,fit; meeting; umbrella; one; mouth; stamp,メイ; ミョウ,いのち,37,8,465,N3
令,1401,1503,orders,orders,meeting; chop-seal; hanko,レイ,,37,5,804,N2
零,1402,1504,zero,zero,rain; weather; orders; meeting; chop-seal; hanko,レイ,ぜろ; こぼ.す; こぼ.れる,37,13,1217,N2
齢,1403,1505,age,age,teeth; tooth; stop; footprint; rice; shovel; orders; meeting; chop-seal; hanko,レイ,よわ.い; とし,37,17,770,N2
冷,1404,1506,cool,cool,ice; orders; meeting; chop-seal; hanko,レイ,つめ.たい; ひ.える; ひ.や; ひ.ややか; ひ.やす; ひ.やかす; さ.める; さ.ます,37,7,667,N3
領,1405,1507,jurisdiction,jurisdiction,orders; meeting; chop-seal; hanko; head; page; one; ceiling; drop; shellfish; clam; oyster; eye; animal legs; eight,リョウ,えり,37,14,138,N2
鈴,1406,1508,small bell,small bell,metal; gold; orders; meeting; chop-seal; hanko,レイ; リン,すず,37,13,880,N1
勇,1407,1509,courage,courage,chop-seal; hanko; male; rice field; brains; power; muscle; arnold,ユウ,いさ.む,37,9,1319,N2
湧,2284,1510,bubble up,bubble up,water; water droplets; water pistol; courageous; courage; chop-seal; hanko; male; rice field; brains; power; muscle; arnold,ユウ; ヨウ; ユ,わ.く,37,12,2070,N1
通,1408,1511,traffic,traffic,pogo stick; chop-seal; hanko; utilise; utilize; road,ツウ; ツ,とお.る; とお.り; -とお.り; -どお.り; とお.す; とお.し; -どお.し; かよ.う,37,10,80,N4
踊,1409,1512,jump,jump,wooden leg; mouth; stop; footprint; pogo stick; chop-seal; hanko; utilise; utilize,ヨウ,おど.る,37,14,1308,N2
疑,1410,1513,doubt,doubt,spoon; sitting on the ground; dart; drop; heavens; chop-seal; hanko; zoo; critters,ギ,うたが.う,37,14,283,N3
擬,1411,1514,mimic,mimic,finger; fingers; doubt; spoon; sitting on the ground; dart; drop; heavens; chop-seal; hanko; zoo; critters,ギ,まが.い; もど.き,37,17,1990,N1
凝,1412,1515,congeal,congeal,ice; doubt; spoon; sitting on the ground; dart; drop; heavens; chop-seal; hanko; zoo; critters,ギョウ,こ.る; こ.らす; こご.らす; こご.らせる; こご.る,37,16,1712,N1
範,1413,1516,pattern,pattern,bamboo; car; fingerprint,ハン,,37,15,1088,N1
犯,1414,1517,crime,crime,pack of wild dogs; fingerprint,ハン; ボン,おか.す,37,5,874,N3
氾,2301,1518,widespread,widespread,water; water droplets; water pistol; fingerprint,ハン,ひろ.がる,37,5,,
厄,1415,1519,unlucky,unlucky,cliff; fingerprint,ヤク,,37,4,2123,N1
危,1416,1520,dangerous,dangerous,bound up; unlucky; cliff; fingerprint,キ,あぶ.ない; あや.うい; あや.ぶむ,37,6,606,N3
宛,1417,1521,address,address,house; mailbox; evening; fingerprint,エン,あ.てる; -あて; -づつ; あたか.も,37,8,,
腕,1418,1522,arm,arm,moon; month; flesh; part of the body; address; house; mailbox; evening; fingerprint,ワン,うで,37,12,1163,N2
苑,1419,1523,garden,garden,flowers; mailbox; evening; fingerprint,エン; オン,その; う.つ,37,8,2060,N1
怨,1420,1524,grudge,grudge,mailbox; evening; fingerprint; heart,エン; オン; ウン,うら.む; うらみ; うら.めしい,37,9,2137,
柳,1421,1525,willow,willow,tree; wood; blown eggs; sign of the hare; receipt; stamp,リュウ,やなぎ,37,9,1169,N1
卵,1422,1526,egg,egg,sign of the hare; receipt; stamp; drops,ラン,たまご,37,7,1342,N2
留,1423,1527,detain,detain,receipt; sword; dagger; rice field; brains,リュウ; ル,と.める; と.まる; とど.める; とど.まる; るうぶる,37,10,731,N3
瑠,2555,1528,marine blue,marine blue,king; jewel; ball; detain; receipt; dagger; sword; rice field; brains,ル; リュウ,,37,14,2352,N1
貿,1424,1529,trade,trade,receipt; sword; dagger; shellfish; clam; oyster; eye; animal legs; eight,ボウ,,37,12,652,N2
印,1425,1530,stamp,stamp,staples,イン,しるし; -じるし; しる.す,37,6,682,N2
臼,2063,1531,mortar,mortar,back to back staples,キュウ; グ,うす; うすづ.く,37,6,2048,
毀,2067,1532,break,break,mortar; soil; dirt; ground; cruise missile; missile; wind; crotch,キ,こぼ.つ; こわ.す; こぼ.れる; こわ.れる; そし.る; やぶ.る,37,13,,
興,1426,1533,entertain,entertain,staples; same; monks; hood; one; mouth; tool; animal legs; eight,コウ; キョウ,おこ.る; おこ.す,37,16,734,N1
酉,1427,1534,sign of the bird,sign of the bird,whiskey bottle; west; one,ユウ,とり,38,7,2468,N1
酒,1428,1535,sake,sake,water; water droplets; water pistol; whiskey bottle,シュ,さけ; さか-,38,10,1006,N3
酌,1429,1536,bartending,bartending,whiskey bottle; ladle,シャク,く.む,38,10,2271,N1
酎,2748,1537,hooch,hooch,whiskey bottle; glue,チュウ; チュ,かも.す,38,10,,
酵,1430,1538,fermentation,fermentation,whiskey bottle; filial piety; old man; child,コウ,,38,14,1862,N1
酷,1431,1539,cruel,cruel,whiskey bottle; revelation; cow; mouth,コク,ひど.い,38,14,1596,N1
酬,1432,1540,repay,repay,whiskey bottle; state; stream; drop,シュウ; シュ; トウ,むく.いる,38,13,1515,N1
酪,1433,1541,dairy products,dairy products,whiskey bottle; each; walking legs; mouth,ラク,,38,13,2012,N1
酢,1434,1542,vinegar,vinegar,whiskey bottle; saw,サク,す,38,12,1955,N1
酔,1435,1543,drunk,drunk,whiskey bottle; ninety; nine; baseball; ten; needle,スイ,よ.う; よ.い; よ,38,11,1640,N1
配,1436,1544,distribute,distribute,whiskey bottle; snake; self,ハイ,くば.る,38,10,359,N3
酸,1437,1545,acid,acid,whiskey bottle; streetwalker; Ministry of silly walks; John Cleese; license; elbow; human legs; walking legs,サン,す.い,38,14,1218,N1
猶,1438,1546,waver,waver,furthermore; pack of wild dogs; chieftain; Molotov cocktail; animal horns; whiskey bottle,ユウ; ユ,なお,38,12,1799,N1
尊,1439,1547,revered,revered,chieftain; Molotov cocktail; animal horns; whiskey bottle; glue,ソン,たっと.い; とうと.い; たっと.ぶ; とうと.ぶ,38,12,1181,N2
豆,1440,1548,beans,beans,table; one; mouth,トウ; ズ,まめ; まめ-,38,7,1422,N1
頭,1441,1549,head,head,beans; table; one; mouth; page; one; ceiling; drop; shellfish; clam; oyster; eye; animal legs; eight,トウ; ズ; ト,あたま; かしら; -がしら; かぶり,38,16,433,N3
短,1442,1550,short,short,dart; drop; heavens; beans; table; one; mouth,タン,みじか.い,38,12,689,N2
豊,1443,1551,bountiful,bountiful,bend; beans; table; one; mouth,ホウ; ブ,ゆた.か; とよ,38,13,762,N2
鼓,1444,1552,drum,drum,samurai; beans; table; one; mouth; branch; ten; needle; crotch,コ,つづみ,38,13,1795,N1
喜,1445,1553,rejoice,rejoice,drum; samurai; beans; table; one; mouth; mouth,キ,よろこ.ぶ; よろこ.ばす,38,12,769,N3
樹,1446,1554,timber-trees,timber-trees,tree; wood; drum; samurai; beans; table; one; mouth; glue,ジュ,き,38,16,988,N1
皿,1447,1555,dish,dish,,ベイ,さら,38,5,1812,N2
血,1448,1556,blood,blood,drop; dish,ケツ,ち,38,6,832,N2
盆,1449,1557,basin,basin,part; eight; sword; dagger; dish,ボン,,38,9,1654,N1
盟,1450,1558,alliance,alliance,bright; sun; day; moon; month; flesh; part of the body; dish,メイ,,38,13,587,N1
盗,1451,1559,steal,steal,next; ice; lack; yawn; dish,トウ,ぬす.む; ぬす.み,38,11,1051,N3
